INITIALIZATION
CREATE TABLE unique_table(id int, col1 int, col2 int);
SUCCESS
INSERT INTO unique_table VALUES (1,1,1);
SUCCESS

1. UNIQUE TEST
CREATE UNIQUE INDEX index_id on unique_table(id);
SUCCESS
INSERT INTO unique_table VALUES (2,1,1);
SUCCESS
CREATE UNIQUE INDEX index_id on unique_table(id);
FAILURE
INSERT INTO unique_table VALUES (3,2,1);
SUCCESS
INSERT INTO unique_table VALUES (1,2,1);
FAILURE

2. SELECT
SELECT * FROM unique_table;
1 | 1 | 1
2 | 1 | 1
3 | 2 | 1
ID | COL1 | COL2

3. UPDATE INFLUENCE
update unique_table set id=2 where col1=1;
FAILURE

4. MULTI UNIQUE TEST
CREATE TABLE unique_table2(id1 int, id2 int, col1 int, col2 int);
SUCCESS
create unique index index_id on unique_table2(id1,id2);
SUCCESS
INSERT INTO unique_table2 VALUES (1,1,1,1);
SUCCESS
INSERT INTO unique_table2 VALUES (2,2,2,2);
SUCCESS
update unique_table2 set id1=1,id2=4 where id2=1;
SUCCESS
select * from unique_table2;
1 | 4 | 1 | 1
2 | 2 | 2 | 2
ID1 | ID2 | COL1 | COL2
update unique_table2 set id1=1,id2=4 where col1=2;
FAILURE
select * from unique_table2;
1 | 4 | 1 | 1
2 | 2 | 2 | 2
ID1 | ID2 | COL1 | COL2
